{"bundle_id":"bundle-snapshot-b209468a35b863a3","extracted_fields":[{"evidence_refs":["EV-001"],"field_path":"intake.context_profile.jurisdiction","value":"NL","value_kind":"scalar"},{"evidence_refs":["EV-001"],"field_path":"intake.context_profile.sector","value":"public","value_kind":"scalar"},{"evidence_refs":["EV-001"],"field_path":"intake.policy_profile.retention_days","value":"30","value_kind":"scalar"}],"schema_version":"intake_bundle_extract_v0_1","source_snapshot_id":"snapshot-b209468a35b863a3"}
